{
  "lesson_id": "armas-de-influencia",
  "title": "Armas de Influência: O Poder dos Atalhos Mentais",
  "objective": "Explicar por que humanos usam atalhos mentais automáticos e como são explorados por aproveitadores.",
  "source_chapter": "Armas de influência",
  "beats": [
    {
      "id": "beat-01",
      "label": "Por que isso importa?",
      "idea": "Compreender nossos atalhos mentais nos protege de manipulação.",
      "content": "## Por que isso importa?\n\nImagine comprar uma joia cara achando que é melhor — só pelo preço. Ou seguir uma ordem absurda de um superior, mesmo sabendo que está errada. Isso acontece porque todos nós usamos atalhos mentais automáticos. Eles nos ajudam a decidir rápido, mas também nos tornam vulneráveis. Nesta aula, você vai entender como esses atalhos funcionam — e como aproveitadores os usam para influenciar você sem que você perceba.",
      "concepts_introduced": []
    },
    {
      "id": "beat-02",
      "label": "Visão geral da aula",
      "idea": "Veremos como atalhos mentais funcionam e como são explorados.",
      "content": "## Visão geral da aula\n\nVamos começar com uma história real: joias de turquesa que ninguém comprava — até que o preço dobrou por engano. Depois, entenderemos um fenômeno chamado *clique, zum*: reações automáticas a certos estímulos. Veremos como isso aparece em animais e em nós. Por fim, aprenderemos como pessoas espertas exploram esses padrões para obter o que querem.",
      "concepts_introduced": []
    },
    {
      "id": "beat-03",
      "label": "História: joias vendidas por mais",
      "idea": "Um aumento de preço gerou mais vendas — por quê?",
      "content": "## História: joias vendidas por mais\n\nUma loja de joias no Arizona não conseguia vender peças de turquesa. A dona, desesperada, deixou um bilhete pedindo para vender pela metade do preço. Mas a funcionária leu '½' como '2'. Resultado? As joias foram vendidas pelo dobro do preço — e todas saíram. Por que isso aconteceu?",
      "concepts_introduced": []
    },
    {
      "id": "beat-04",
      "label": "Padrão fixo de ação em animais",
      "idea": "Animais reagem automaticamente a estímulos específicos.",
      "content": "## Padrão fixo de ação em animais\n\nEm etologia, estuda-se o comportamento animal em seu habitat natural. Um exemplo: a perua mãe. Ela cuida dos filhotes apenas quando ouve o som que eles emitem. Se um gravador tocar esse som em uma doninha empalhada, a perua a acolhe — mesmo sendo seu inimigo. O comportamento é acionado por um único estímulo: o *piar*. Isso se chama *padrão fixo de ação*.",
      "concepts_introduced": [
        "padrao-fixo-de-acao"
      ]
    },
    {
      "id": "beat-05",
      "label": "Característica desencadeadora",
      "idea": "Um único detalhe pode acionar uma reação automática.",
      "content": "## Característica desencadeadora\n\nNos experimentos com tordos, o ataque territorial é desencadeado não pelo rival inteiro, mas por um detalhe: a cor vermelha no peito. Um tufo de penas vermelhas basta para provocar fúria. O animal ignora uma réplica perfeita sem esse detalhe. Esse estímulo específico é chamado de *característica desencadeadora*.",
      "concepts_introduced": [
        "caracteristica-desencadeadora"
      ]
    },
    {
      "id": "beat-06",
      "label": "Clique, zum: no ser humano",
      "idea": "Humanos também têm reações automáticas a certos estímulos.",
      "content": "## Clique, zum: no ser humano\n\nNum experimento, pessoas deixavam alguém passar na fila da copiadora com mais frequência se ouvissem a palavra *porque*, mesmo que o motivo fosse óbvio: 'Posso usar porque preciso tirar cópias?'. A palavra *porque* é a característica desencadeadora — aciona a fita automática de concordância. É o *clique, zum*: o estímulo dispara a resposta sem reflexão.",
      "concepts_introduced": [
        "clique-zum"
      ]
    },
    {
      "id": "beat-07",
      "label": "Atalho mental: caro = bom",
      "idea": "Pessoas usam regras simples para decidir sem pensar.",
      "content": "## Atalho mental: caro = bom\n\nOs turistas que compraram as joias de turquesa usaram um atalho: 'caro é igual a bom'. Eles não conheciam a pedra, então confiaram no preço como sinal de qualidade. Esse é um *atalho mental*: uma regra simples que economiza esforço cognitivo. Funciona na maioria das vezes — mas pode falhar.",
      "concepts_introduced": [
        "atalho-mental"
      ]
    },
    {
      "id": "beat-08",
      "label": "Por que usamos atalhos?",
      "idea": "Atalhos são necessários por causa da complexidade da vida.",
      "content": "## Por que usamos atalhos?\n\nNão temos tempo, energia ou capacidade para analisar tudo. Precisamos de atalhos para agir rápido. Sem eles, ficaríamos paralisados. O problema é que, ao reagir automaticamente a uma característica desencadeadora, podemos ser enganados — especialmente quando o estímulo é falso.",
      "concepts_introduced": []
    },
    {
      "id": "beat-09",
      "label": "Aproveitadores exploram atalhos",
      "idea": "Pessoas más-intencionadas imitam estímulos para manipular.",
      "content": "## Aproveitadores exploram atalhos\n\nNa natureza, vaga-lumes fêmeas imitam os sinais de acasalamento de outras espécies para atrair e devorar os machos. Eles respondem ao estímulo — e caem na armadilha. Da mesma forma, aproveitadores humanos imitam características desencadeadoras para ativar nossas fitas automáticas: usam títulos, roupas ou palavras que simulam autoridade, urgência ou escassez.",
      "concepts_introduced": [
        "aproveitador"
      ]
    },
    {
      "id": "beat-10",
      "label": "Consolidação: o ciclo completo",
      "idea": "Reconhecemos o padrão: estímulo → reação automática → exploração.",
      "content": "## Consolidação: o ciclo completo\n\nVimos que humanos, como animais, têm reações automáticas a certos estímulos. Usamos atalhos mentais porque precisamos. Mas isso nos torna vulneráveis. Apreveitadores — consciente ou inconscientemente — imitam características desencadeadoras para ativar nossas fitas de resposta. O segredo é reconhecer quando estamos reagindo por *clique, zum* e, quando importa, pausar para uma reação controlada.",
      "concepts_introduced": []
    }
  ],
  "meta": {
    "total_concepts": 5,
    "author_agent": "content_author",
    "model": "qwen/qwen3-235b-a22b-2507"
  }
}