{
  "lesson_id": "armas-de-influencia-clique-zum",
  "title": "Armas de Influência: O Padrão Clique, Zum",
  "objective": "Explicar por que humanos usam atalhos mentais automáticos e como são explorados por características desencadeadoras.",
  "source_chapter": "Cialdini, Capítulo 1",
  "beats": [
    {
      "id": "beat-01",
      "label": "WHY: Por que isso importa?",
      "idea": "Compreender como decisões automáticas podem ser exploradas é crucial em um mundo cheio de manipuladores.",
      "content": "## Por que isso importa?\n\nImagine tomar decisões importantes — como comprar um presente ou escolher um voo — baseado em sinais automáticos que mal percebe. Pior: imagine que outros saibam exatamente como acionar esses sinais para obter o que querem de você. Isso não é ficção. É o que acontece quando padrões automáticos de comportamento são explorados. Entender esse mecanismo é o primeiro passo para não ser enganado por quem domina as armas de influência.",
      "concepts_introduced": []
    },
    {
      "id": "beat-02",
      "label": "OVERVIEW: O todo",
      "idea": "Humanos usam atalhos mentais automáticos ('clique, zum') que podem ser explorados por aproveitadores.",
      "content": "## O que vamos ver\n\nVamos entender:\n\n1. Por que confiamos em reações automáticas para decidir;\n2. O que são características desencadeadoras;\n3. Como o comportamento humano imita padrões animais;\n4. Como aproveitadores as usam para manipular;\n5. Por que isso é racional, mas perigoso.\n\nTudo gira em torno do automatismo: _clique_, a característica aparece, _zum_, a reação acontece — sem pensar.",
      "concepts_introduced": [
        "clique-zum",
        "atalho mental",
        "aproveitador"
      ]
    },
    {
      "id": "beat-03",
      "label": "Pré-treino: Padrão fixo",
      "idea": "Animais têm comportamentos automáticos chamados padrões fixos de ação.",
      "content": "## Padrão fixo de ação\n\nEm etologia, certos animais reagem a estímulos específicos com sequências completas de comportamento. Por exemplo, uma perua mãe cuida dos filhotes apenas quando ouve o piar característico. Mesmo que o som venha de uma doninha empalhada com um gravador, ela acolhe o inimigo. O comportamento é automático: _clique_, o som toca, _zum_, ela reage.",
      "concepts_introduced": [
        "padrão fixo de ação"
      ]
    },
    {
      "id": "beat-04",
      "label": "Pré-treino: Desencadeador",
      "idea": "Um detalhe específico pode disparar uma reação automática inteira.",
      "content": "## Característica desencadeadora\n\nNão é o animal inteiro que dispara a reação — é um único sinal. Um tordo ataca um tufo de penas vermelhas, ignorando uma réplica perfeita sem essa cor. O detalhe — vermelho no peito — é o gatilho. Chamamos isso de característica desencadeadora: um sinal mínimo que aciona uma fita comportamental inteira.",
      "concepts_introduced": [
        "característica desencadeadora"
      ]
    },
    {
      "id": "beat-05",
      "label": "Desenvolvimento: Clique, zum humano",
      "idea": "Humanos também têm reações automáticas acionadas por palavras ou sinais.",
      "content": "## O 'porque' que não explica nada\n\nNum experimento, pessoas deixavam alguém passar na fila com mais frequência se o pedido incluía 'porque', mesmo que o motivo fosse óbvio: 'posso usar a xerox porque preciso tirar cópias?'. A palavra 'porque' é o gatilho — o conteúdo não importa. Assim como o piar do filhote, 'porque' dispara consentimento automático: _clique_, _zum_.",
      "concepts_introduced": [
        "reação automática humana"
      ]
    },
    {
      "id": "beat-06",
      "label": "Desenvolvimento: Caro = bom?",
      "idea": "O preço alto pode ser um gatilho para percepção de qualidade, mesmo sem evidência real.",
      "content": "## O erro do dobro do preço\n\nUma joalheria não vendia joias de turquesa. A dona pediu para vender pela metade do preço, mas a funcionária leu '2' em vez de '½'. Resultado? Todas vendidas — pelo dobro do valor. Por quê? Clientes turistas usaram o atalho: 'caro = bom'. O preço alto foi o desencadeador. Não analisaram a pedra — reagiram automaticamente.",
      "concepts_introduced": [
        "atalho 'caro=bom'"
      ]
    },
    {
      "id": "beat-07",
      "label": "Desenvolvimento: Por que usamos atalhos?",
      "idea": "Atalhos são necessários por causa da complexidade do mundo moderno.",
      "content": "## Por que simplificamos?\n\nNão temos tempo, energia ou capacidade para analisar tudo. Então usamos regras gerais: 'especialista = confiável', 'caro = bom'. Esses atalhos funcionam na maioria das vezes. São eficientes. Mas nos deixam vulneráveis quando o sinal é falso ou explorado.",
      "concepts_introduced": [
        "necessidade de atalhos"
      ]
    },
    {
      "id": "beat-08",
      "label": "Desenvolvimento: Reação controlada",
      "idea": "Só analisamos detalhes quando a decisão nos afeta diretamente.",
      "content": "## Quando pensamos de verdade\n\nNum estudo, alunos que seriam afetados por exames obrigatórios analisaram a qualidade dos argumentos. Os que não seriam afetados confiaram na autoridade do orador. Quando o risco é baixo, usamos 'clique, zum'. Quando é alto, tentamos reagir com controle. Mas nem sempre conseguimos — o tempo, a pressão ou a fadiga podem impedir.",
      "concepts_introduced": [
        "reação controlada"
      ]
    },
    {
      "id": "beat-09",
      "label": "Desenvolvimento: Captainitis",
      "idea": "Mesmo em risco alto, hierarquia pode acionar reação automática perigosa.",
      "content": "## O copiloto que obedeceu\n\nUm general cantava mentalmente e balançava a cabeça. O copiloto interpretou como ordem para recolher o trem de pouso — mesmo sabendo que o avião não levantaria voo. O gatilho? A autoridade do general. Isso mostra: até em situações críticas, o automatismo 'especialista = sempre certo' pode prevalecer. É o 'captainitis': obediência cega à autoridade.",
      "concepts_introduced": [
        "captainitis"
      ]
    },
    {
      "id": "beat-10",
      "label": "Desenvolvimento: Imitadores naturais",
      "idea": "Na natureza, alguns animais imitam sinais para enganar presas.",
      "content": "## A vaga-lume assassina\n\nFêmeas de *Photuris* imitam os sinais de acasalamento de *Photinus* para atrair e devorar os machos. O sinal desencadeador — o piscar específico — é copiado. A vítima reage automaticamente: _clique_, _zum_, morte. É um ataque direto ao padrão fixo de ação da presa.",
      "concepts_introduced": [
        "imitador"
      ]
    },
    {
      "id": "beat-11",
      "label": "Desenvolvimento: Imitadores humanos",
      "idea": "Pessoas exploram intencionalmente características desencadeadoras para influenciar.",
      "content": "## O aproveitador humano\n\nAssim como a vaga-lume, algumas pessoas imitam sinais de autoridade, escassez ou urgência para obter concordância. Um vendedor pode dizer 'porque você é especial' — acionando o automatismo de valor. Ou aumentar o preço para parecer mais desejável. Não é acidente: é uso deliberado da arma de influência.",
      "concepts_introduced": [
        "aproveitador humano"
      ]
    },
    {
      "id": "beat-12",
      "label": "Consolidação: O ciclo completo",
      "idea": "Padrões automáticos são úteis, mas exploráveis — e os aproveitadores sabem disso.",
      "content": "## Tudo junto\n\n1. Vivemos em um mundo complexo → precisamos de atalhos;\n2. Atalhos são acionados por características desencadeadoras ('clique, zum');\n3. Eles funcionam bem na maioria das vezes;\n4. Mas podem ser explorados por imitadores — humanos ou não;\n5. Aqueles que conhecem os gatilhos os usam intencionalmente;\n6. A solução? Reconhecer quando estamos reagindo automaticamente — e pausar, quando necessário.\n\nO automatismo é inevitável. A manipulação, nem sempre. Com consciência, podemos escolher quando reagir — e quando pensar.",
      "concepts_introduced": []
    }
  ],
  "meta": {
    "total_concepts": 9,
    "author_agent": "content_author",
    "model": "qwen/qwen3-235b-a22b-2507"
  }
}