{
  "lesson_id": "armas-de-influencia-padroes-automaticos",
  "title": "Armas de Influência: Por Que Reagimos Sem Pensar",
  "objective": "Ao final desta aula, o aluno compreenderá como humanos desenvolvem padrões automáticos de comportamento (reação clique-zum), por que dependemos de atalhos mentais e como pessoas podem explorar deliberadamente essas características desencadeadoras para obter concordância.",
  "source_chapter": "Cialdini, Cap. 1 - Armas de Influência (primeira fatia)",
  "beats": [
    {
      "id": "beat-01",
      "label": "Por que reagimos sem pensar",
      "idea": "Você já comprou algo caro só porque era caro? Descubra por que fazemos escolhas automáticas.",
      "content": "## Por que reagimos sem pensar?\n\nImagine a seguinte situação: você está numa joalheria, hesitante entre dois colares de turquesa. Um custa R$ 200, outro R$ 400. Qual você escolhe?\n\nSe você chose o mais caro, não está sozinho. Neste capítulo, vamos explorar um fenômeno surpreendente: humanos, assim como animais, possuem padrões de comportamento automático que podem ser acionados por características específicas — e pessoas espertas sabem explorar isso.\n\nA pergunta central é: **por que deixamos quegatilhos invisíveis controlem nossas decisões?**",
      "concepts_introduced": [
        "comportamento automático",
        "gatilhos de decisão"
      ]
    },
    {
      "id": "beat-02",
      "label": "Mapa do território",
      "idea": " Veja o que vamos descobrir: de peruas mães a compras por impulso.",
      "content": "## O que vamos descobrir\n\nEste capítulo explora três questões fundamentais:\n\n1. **O que são os padrões automáticos de comportamento** — aprendemos com animais como peruas e vaga-lumes\n2. **Por que dependemos de atalhos mentais** — por que é racional não pensar em tudo\n3. **Como pessoas exploram esses padrões** — os \"aproveitadores\" humanos\n\nAo longo desta aula, você entenderá por que a palavra \"porque\" nos faz aceitar pedidos, por que preço alto às vezes vende mais, e como evitar ser manipulado.",
      "concepts_introduced": [
        "padrões automáticos de comportamento",
        "atalhos mentais"
      ]
    },
    {
      "id": "beat-03",
      "label": "Padrões fixos de ação",
      "idea": "Animais têm \"fitas\" gravadas que tocam automaticamente em situações específicas.",
      "content": "## Os padrõesfixos de ação\n\nNa natureza, muitos animais possuem comportamentos que ocorrem sempre da mesma forma, como se estivessem gravados em fitas cassetes. Os etólogos chamam isso de **padrões fixos de ação**.\n\nVeja o exemplo das peruas mães:\n\n- Elas são excelentes mães — carinhosas, protetoras\n- Mas quase todos os seus cuidados são desencadeados por um único som: o piar dos filhotes\n- Se um filhote não piar, a mãe pode ignorá-lo ou até matá-lo\n\nIsso parece ridículo, mas funciona na natureza. O som dos filhotes é um indicador confiável de que precisam de cuidados.",
      "concepts_introduced": [
        "padrões fixos de ação",
        "etologia"
      ]
    },
    {
      "id": "beat-04",
      "label": "Características desencadeadoras",
      "idea": "Basta um detalle minúsculo para ativar comportamentos complexos inteiros.",
      "content": "## O poder das características desencadeadoras\n\nO mais interessante é como essas \"fitas\" são ativadas. Não é o animal inteiro que funciona como gatilho — é uma **característica desencadeadora** específica e muitas vezes minúscula.\n\nExemplos da natureza:\n\n- Um tordo macho ataca um tufo de penas vermelhas, ignorando uma ave empalhada completa sem essas penas\n- Um pisco-de-peito-azul reage ao tom de azul nas penas do peito de um rival\n\nA perua mãe aceita uma doninha empalhada se ela emitir o som dos filhotes — mas ataca a mesma doninha se o som parar.\n\n**Uma única característica pode controlar um comportamento inteiro.**",
      "concepts_introduced": [
        "características desencadeadoras",
        "estímulo gatilho"
      ]
    },
    {
      "id": "beat-05",
      "label": "Reação clique-zum",
      "idea": "Assim como animais, humanos também têm fitas que tocam automaticamente.",
      "content": "## A reação \"clique, zum\"\n\nOs etólogos usam a metáfora do \"clique, zum\":\n\n- **Clique** = a característica desencadeadora aparece\n- **Zum** = a \"fita\" toca automaticamente\n\nE não somos diferentes. A psychologist social Ellen Langer fez um experimento clássico:\n\nEla pediu para usar a copiadora de uma biblioteca:\n- Com justification: \"tenho cinco páginas, posso usar porque estou com pressa?\" → 94% concordaram\n- Sem justification: apenas 60% concordaram\n- **Mas** usando \"porque\" sem motivo real (\"porque preciso tirar unas cópias\"): 93% concordaram\n\nA palavra \"porque\" sozinha disparou a reação de consentimento — mesmo sem motivo relevante. O mesmo princípio do som dos filhotes na perua.",
      "concepts_introduced": [
        "reação automática",
        "clique-zum"
      ]
    },
    {
      "id": "beat-06",
      "label": "Reação controlada vs automática",
      "idea": "Nem sempre reagimos automaticamente — Depends de interesse pessoal e capacidade de análise.",
      "content": "## Quando reagimos automaticamente?\n\nNem sempre usamos o \"clique, zum\". Há dois tipos de reação:\n\n**Reação automática** (clique-zum):\n- Reagimos a uma única característica\n- Não analisamos os argumentos\n- É mais rápida e fácil\n\n**Reação controlada**:\n- Analisamos todas as informações\n- Pensamos cuidadosamente\n- Exige tempo e energia\n\nPesquisas mostram que usamos reação controlada quando:\n- O assunto tem importância pessoal\n- Temos tempo e capacidade para analisar\n\nMas na vida moderna, muitas vezes não temos condições de analisar tudo — então usamos atalhos.",
      "concepts_introduced": [
        "reação controlada",
        "análise racional"
      ]
    },
    {
      "id": "beat-07",
      "label": "Atalhos mentais",
      "idea": "Usamos estereótipos para reduzir risco e tomar decisões rápidas.",
      "content": "## Por que usamos atalhos\n\nViver num mundo complexo exige atalhos. Não podemos analisar cada aspecto de cada pessoa, situação ou decisão — não temos tempo, energia ou capacidade.\n\nOs **atalhos mentais** (ou heurísticas) são regras simples que funcionam na maioria das vezes:\n\n- \"Se um especialista disse, deve ser verdade\"\n- \"Caro é igual a bom\"\n- \"Se está em promoção, é um bom negócio\"\n\nEsses estereótipos nos ajudam a reduzir risco. Quando não conocemos um produto, confiamos no preço como indicador de qualidade. É uma estratégia racional — funciona na maioria das situações.\n\nMas nem sempre. E é aí que entra a vulnerabilidade.",
      "concepts_introduced": [
        "atalhos mentais",
        "estereótipos"
      ]
    },
    {
      "id": "beat-08",
      "label": "Princípio caro = bom",
      "idea": "O preço alto ativa automaticamente a percepção de qualidade superior.",
      "content": "## O poder do \"caro é igual a bom\"\n\nLembra da história da joalheria do início? Um lote de turquesa não vendia. A dona pediu para vender pela metade do preço — mas a funcionária leu \"½\" como \"2\".\n\nResultado: **vendido pelo dobro do preço original!**\n\nPor que isso aconteceu? Os turistas:\n- Queriam joias \"de qualidade\"\n- Não conheciam turquesa\n- Usaram o estereótipo \"caro = bom\"\n- O preço alto se tornou uma característica desencadeadora de qualidade\n\nPesquisas confirmam: pessoas em dúvida sobre qualidade usam preço como indicador. Isso acontece com vinho, perfumes, produtos de luxo — em toda parte.",
      "concepts_introduced": [
        "princípio caro=bom",
        "percepção de qualidade"
      ]
    },
    {
      "id": "beat-09",
      "label": "Os aproveitadores",
      "idea": "Pessoas que Imitam características desencadeadoras para obter vantagem.",
      "content": "## Quem explora esses padrões\n\nNa natureza, existem **imitadores** que copiam características desencadeadoras para induzir reações erradas:\n\n- Vaga-lumes fêmeas assassinas imitam os sinais de corte dos machos de outra espécie — eles voam para a morte\n- Bactérias imitam hormônios para entrar em células hospedeiras\n\nNa selva humana, acontece o mesmo. Algumas pessoas:\n- Sabem como funcionam nossas \"fitas\"\n- Estruturam pedidos para acionargatilhos específicos\n- Usam palavras certas, preços certos, ситуаções certas\n\nA amiga da joalheria aprendeu isso: agora aumenta preços para vender mais. É uma \"arma de influência\" — e agora você knows como funciona.",
      "concepts_introduced": [
        "imitadores",
        "armas de influência"
      ]
    },
    {
      "id": "beat-10",
      "label": "Consolidação",
      "idea": "Reações automáticas são inevitáveis — o segredo está em reconhecer quando estamos sendo manipulados.",
      "content": "## O que aprendemos\n\nChegamos ao final desta aula. Vamos recapitular:\n\n1. **Padrões fixos de ação** existem em animais e humanos — comportamentos que ocorrem automaticamente\n2. **Características desencadeadoras** são detalhes mínimos que disparam comportamentos inteiros\n3. **Reação clique-zum** é a resposta automática a esses gatilhos\n4. Usamos **atalhos mentais** porque é racional — não temos capacidade de analisar tudo\n5. O princípio **\"caro = bom\"** é um dos muitos estereótipos que guiam nossas decisões\n6. **Aproveitadores** conhecem esses padrões e os exploram deliberadamente\n\nA conclusão não é parar de usar atalhos — seria impossível. É **reconhecer** quando estamos sendo manipulados. A partir de agora, você verá as \"armas de influência\" em ação.",
      "concepts_introduced": []
    }
  ],
  "meta": {
    "total_concepts": 14,
    "author_agent": "content_author",
    "model": "minimax-m2.5:cloud"
  }
}